{
  "schema_version": 1,
  "artifact_kind": "pooleos_native_firmware_readiness",
  "contract_id": "PFWM1",
  "status": "pass",
  "inputs": {
    "contract": {
      "path": "specs/native-firmware-contract.json",
      "bytes": 8778,
      "sha256": "AC17DAA4BF44272F788933CC7440456E3B20F1FD2D663EFE07FE26997ADCDB26"
    },
    "golden_vectors": {
      "path": "specs/native-firmware-golden-vectors.json",
      "bytes": 24813,
      "sha256": "AAF62CD7D31C15E05CC208BD3E0C0E6A19A834F360F71E166085075850BFD92D"
    },
    "toolchain_lock": {
      "path": "specs/native-toolchain-lock.json",
      "bytes": 4017,
      "sha256": "79084B39BC43C0B3B96ABE93328184338470A2FFFF257C6E2305215E6B2CCA4E"
    },
    "toolchain_qualification": {
      "path": "runs/native_toolchain_qualification.json",
      "bytes": 14423,
      "sha256": "87668ADC571427244CD490D172CD01BAA3871709A0D76F7319D665526B68CFB5"
    },
    "tier1_profile": {
      "path": "specs/tier1-hardware-target.json",
      "bytes": 9005,
      "sha256": "E6976539E72D32974918B2ABA7AB53043AB44AB478D8CBA0ABF9E30E66869F89"
    },
    "implementation_inputs": [
      {
        "path": "native/.cargo/config.toml",
        "bytes": 539,
        "sha256": "7983881C5CAD2B909CCA64BFA7F5895EC56377B0E52967444CB2818A69FA4FE1"
      },
      {
        "path": "native/rust-toolchain.toml",
        "bytes": 131,
        "sha256": "06C4E0BD63FE84DCB26A0FAE52D96F23C38979DBE6F154D58EAB1547F81FA26B"
      },
      {
        "path": "specs/native-toolchain-lock.json",
        "bytes": 4017,
        "sha256": "79084B39BC43C0B3B96ABE93328184338470A2FFFF257C6E2305215E6B2CCA4E"
      },
      {
        "path": "specs/native-host-msvc-profile.json",
        "bytes": 2092,
        "sha256": "4BD6B069392E11215EE1942425B3A12CE2CAEC6746A9450EAC20B037FC538182"
      },
      {
        "path": "tools/native_host_toolchain.py",
        "bytes": 5317,
        "sha256": "4AC87084B9B1F023C1FE2518858899A4A71BF90B9CA4DF3D312E342257E3099F"
      },
      {
        "path": "tools/qualify_native_toolchain.py",
        "bytes": 22364,
        "sha256": "655FCC0A572AE4FB2899840007F22A31CDCF9D114952C60F657EE3F4BF0F9C50"
      },
      {
        "path": "tests/test_native_boot_host_toolchain.py",
        "bytes": 8247,
        "sha256": "39514B13649D45BB60C2C0471F80F45D4B176C018ED7C7B9B430BC4D8DE63C02"
      },
      {
        "path": "native/Cargo.toml",
        "bytes": 601,
        "sha256": "210BCDAF2778606B42C688E7BACD950FC0EEF3045081E884CF7846B9A7D78DF4"
      },
      {
        "path": "native/Cargo.lock",
        "bytes": 4193,
        "sha256": "29CE9938C5C60DEA5AEA244A6961BB1924D88AEC601D1E02EAAA510B0B36E390"
      },
      {
        "path": "native/firmware/Cargo.toml",
        "bytes": 350,
        "sha256": "14CEE861F16A5F6E0A984F12036FA64422453178CBDA235622E0681C59C6C42E"
      },
      {
        "path": "native/firmware/src/lib.rs",
        "bytes": 46302,
        "sha256": "3FAE1CE011532BF847BD5BBB9AB59347259CC1A38D5139AB19070E30BCE413FA"
      },
      {
        "path": "native/firmware/src/bin/pfwm1_probe.rs",
        "bytes": 9243,
        "sha256": "6A51D820F088766F2AB466E9B1BFA5D40501447DD7925306F18B09F4C322E854"
      },
      {
        "path": "runtime/native_firmware.py",
        "bytes": 52263,
        "sha256": "CA55F8DA2D3FE585FB35D9E10E576B5B7FC8F132A752EAE92CFDE0521A63EDFC"
      },
      {
        "path": "tools/generate_native_firmware_vectors.py",
        "bytes": 1436,
        "sha256": "475CAA14ED92D6C9ADB96EC19F08D13507767C9653CB9B653E5DEF5D45E9AA56"
      },
      {
        "path": "tools/qualify_native_firmware.py",
        "bytes": 31868,
        "sha256": "C230B4CA63B655AD2CC6D1281249750C3D95DEF3FD4BB3EBC94AE98B82FB5EC8"
      },
      {
        "path": "tests/test_native_firmware.py",
        "bytes": 6191,
        "sha256": "F4B230AA7D6D40C06B7281680417314C6BD3AA7A2EA0019EFE789E106FF9ABAB"
      },
      {
        "path": "docs/native-firmware-manifest.md",
        "bytes": 9218,
        "sha256": "C518E7772198AA8C85B8CB3961411B9FBB6B9351B1A4B0EDB5BF4759550D5A20"
      }
    ]
  },
  "build": {
    "status": "pass",
    "rustc": "rustc 1.97.0 (2d8144b78 2026-07-07)",
    "host_tests": 5,
    "host_toolchain": {
      "profile_id": "POOLEOS-HOST-MSVC-1",
      "profile_sha256": "4BD6B069392E11215EE1942425B3A12CE2CAEC6746A9450EAC20B037FC538182",
      "verified_before_build": true,
      "scope": "host_linker_and_library_trees_not_complete_host_attestation"
    },
    "rustfmt_packages": 1,
    "clippy_targets": 1,
    "no_std_targets": [
      "x86_64-unknown-none",
      "x86_64-unknown-uefi"
    ]
  },
  "golden": {
    "status": "pass",
    "vector_count": 3,
    "python_vectors": 3,
    "rust_vectors": 3
  },
  "negative_controls": [
    {
      "id": "NEG-N5-PFWM-PARSE-TRUNCATED",
      "expected": "pfwm_truncated",
      "status": "pass"
    },
    {
      "id": "NEG-N5-PFWM-PARSE-OVERSIZED",
      "expected": "pfwm_oversized",
      "status": "pass"
    },
    {
      "id": "NEG-N5-PFWM-PARSE-MAGIC",
      "expected": "pfwm_magic",
      "status": "pass"
    },
    {
      "id": "NEG-N5-PFWM-PARSE-VERSION",
      "expected": "pfwm_version",
      "status": "pass"
    },
    {
      "id": "NEG-N5-PFWM-PARSE-HEADER-SIZE",
      "expected": "pfwm_header_size",
      "status": "pass"
    },
    {
      "id": "NEG-N5-PFWM-PARSE-RECORD-SIZE",
      "expected": "pfwm_record_size",
      "status": "pass"
    },
    {
      "id": "NEG-N5-PFWM-PARSE-PROFILE",
      "expected": "pfwm_profile",
      "status": "pass"
    },
    {
      "id": "NEG-N5-PFWM-PARSE-FLAGS",
      "expected": "pfwm_flags",
      "status": "pass"
    },
    {
      "id": "NEG-N5-PFWM-PARSE-MANIFEST-VERSION",
      "expected": "pfwm_manifest_version",
      "status": "pass"
    },
    {
      "id": "NEG-N5-PFWM-PARSE-COUNTS",
      "expected": "pfwm_counts",
      "status": "pass"
    },
    {
      "id": "NEG-N5-PFWM-PARSE-COMPONENT-OFFSET",
      "expected": "pfwm_table_layout",
      "status": "pass"
    },
    {
      "id": "NEG-N5-PFWM-PARSE-DEPENDENCY-OFFSET",
      "expected": "pfwm_table_layout",
      "status": "pass"
    },
    {
      "id": "NEG-N5-PFWM-PARSE-TOTAL-SIZE",
      "expected": "pfwm_truncated",
      "status": "pass"
    },
    {
      "id": "NEG-N5-PFWM-PARSE-TRAILING",
      "expected": "pfwm_trailing_bytes",
      "status": "pass"
    },
    {
      "id": "NEG-N5-PFWM-PARSE-LIMITS",
      "expected": "pfwm_limits",
      "status": "pass"
    },
    {
      "id": "NEG-N5-PFWM-PARSE-DIGEST-ZERO",
      "expected": "pfwm_digest_zero",
      "status": "pass"
    },
    {
      "id": "NEG-N5-PFWM-PARSE-MANIFEST-ID",
      "expected": "pfwm_manifest_id",
      "status": "pass"
    },
    {
      "id": "NEG-N5-PFWM-PARSE-RESERVED",
      "expected": "pfwm_reserved",
      "status": "pass"
    },
    {
      "id": "NEG-N5-PFWM-PARSE-BODY-DIGEST",
      "expected": "pfwm_body_digest",
      "status": "pass"
    },
    {
      "id": "NEG-N5-PFWM-PARSE-COMPONENT-ID",
      "expected": "pfwm_component_id",
      "status": "pass"
    },
    {
      "id": "NEG-N5-PFWM-PARSE-COMPONENT-DUPLICATE-ID",
      "expected": "pfwm_component_id",
      "status": "pass"
    },
    {
      "id": "NEG-N5-PFWM-PARSE-COMPONENT-ORDER",
      "expected": "pfwm_component_order",
      "status": "pass"
    },
    {
      "id": "NEG-N5-PFWM-PARSE-COMPONENT-KIND",
      "expected": "pfwm_component_kind",
      "status": "pass"
    },
    {
      "id": "NEG-N5-PFWM-PARSE-COMPONENT-TRANSPORT",
      "expected": "pfwm_component_transport",
      "status": "pass"
    },
    {
      "id": "NEG-N5-PFWM-PARSE-COMPONENT-MAPPING",
      "expected": "pfwm_component_mapping",
      "status": "pass"
    },
    {
      "id": "NEG-N5-PFWM-PARSE-COMPONENT-FLAGS",
      "expected": "pfwm_component_flags",
      "status": "pass"
    },
    {
      "id": "NEG-N5-PFWM-PARSE-COMPONENT-RESERVED",
      "expected": "pfwm_component_reserved",
      "status": "pass"
    },
    {
      "id": "NEG-N5-PFWM-PARSE-COMPONENT-GUID",
      "expected": "pfwm_component_guid",
      "status": "pass"
    },
    {
      "id": "NEG-N5-PFWM-PARSE-COMPONENT-DUPLICATE-GUID",
      "expected": "pfwm_component_guid",
      "status": "pass"
    },
    {
      "id": "NEG-N5-PFWM-PARSE-COMPONENT-HARDWARE-INSTANCE",
      "expected": "pfwm_component_hardware_instance",
      "status": "pass"
    },
    {
      "id": "NEG-N5-PFWM-PARSE-COMPONENT-VERSIONS",
      "expected": "pfwm_component_versions",
      "status": "pass"
    },
    {
      "id": "NEG-N5-PFWM-PARSE-COMPONENT-PAYLOAD-SIZE",
      "expected": "pfwm_component_payload_size",
      "status": "pass"
    },
    {
      "id": "NEG-N5-PFWM-PARSE-COMPONENT-DIGEST",
      "expected": "pfwm_component_digest",
      "status": "pass"
    },
    {
      "id": "NEG-N5-PFWM-PARSE-DEPENDENCY-LAYOUT",
      "expected": "pfwm_dependency_layout",
      "status": "pass"
    },
    {
      "id": "NEG-N5-PFWM-PARSE-DEPENDENCY-ID",
      "expected": "pfwm_dependency_id",
      "status": "pass"
    },
    {
      "id": "NEG-N5-PFWM-PARSE-DEPENDENCY-VERSION",
      "expected": "pfwm_dependency_version",
      "status": "pass"
    },
    {
      "id": "NEG-N5-PFWM-PARSE-DEPENDENCY-PHASE",
      "expected": "pfwm_dependency_phase",
      "status": "pass"
    },
    {
      "id": "NEG-N5-PFWM-PARSE-PHASE-GAP",
      "expected": "pfwm_phase_order",
      "status": "pass"
    },
    {
      "id": "NEG-N5-PFWM-PARSE-MANIFEST-PAYLOAD-LIMIT",
      "expected": "pfwm_component_payload_size",
      "status": "pass"
    },
    {
      "id": "NEG-N5-PFWM-ACTIVATE-DEVELOPMENT",
      "expected": "pfwm_activation_outer_signature",
      "status": "pass"
    },
    {
      "id": "NEG-N5-PFWM-ACTIVATE-OUTER-SIGNATURE",
      "expected": "pfwm_activation_outer_signature",
      "status": "pass"
    },
    {
      "id": "NEG-N5-PFWM-ACTIVATE-OUTER-ROLE",
      "expected": "pfwm_activation_outer_role",
      "status": "pass"